{
  "updated_at": "2026-10-12",
  "source": "Tushare sw_daily + index_member + fina_indicator_vip",
  "stale_after_minutes": 1440,
  "status": "ok",
  "status_message": "已生成 5 个可用行业面板，0 个部分可用，0 个失败，1 个占位条目待后续补充。",
  "boards": [
    {
      "board_id": "real-estate",
      "title": "地产",
      "anchor": "real-estate",
      "description": "地产板块先用申万地产跟踪估值与交易位置，港股物业保留占位，等待后续稳定口径接入。",
      "fundamentals_placeholder": {
        "title": "基本面数据跟踪待补充",
        "description": "后续将在这里补充销售、拿地、房价、库存与竣工等高频数据。",
        "planned_metrics": [
          "商品房销售额与销售面积",
          "重点城市库存与去化周期",
          "房价与土地成交",
          "新开工与竣工节奏"
        ]
      },
      "industries": [
        {
          "ts_code": "801180.SI",
          "name": "申万地产",
          "market": "A股",
          "enabled": true,
          "status": "ready",
          "status_message": "用申万地产指数观察股价、PB、ROE 历史位置与交易拥挤度。",
          "latest_trade_date": "2026-10-09",
          "latest_close": 1979.4,
          "latest_pct_change": -0.24,
          "pb": 0.84,
          "amount": 2343698.0,
          "float_mv": 42916228.0,
          "member_count": 95,
          "pb_percentiles": {
            "three_year": 83.8,
            "five_year": 58.0
          },
          "crowdedness": {
            "amount_pct": 52.8,
            "turnover_ratio_pct": 74.6,
            "score": 63.7,
            "label": "中性"
          },
          "pb_roe_alignment": {
            "pb_pct_3y": 83.8,
            "pb_pct_5y": 58.0,
            "roe_pct_20q": 15.8,
            "current_roe": -0.86,
            "current_roe_period": "2026-06-30",
            "match_gap": 42.2,
            "status": "expensive_vs_roe",
            "label": "估值高于业绩"
          }
        },
        {
          "ts_code": "931744.CSI",
          "name": "港股物业",
          "market": "港股",
          "enabled": false,
          "status": "coming_soon",
          "status_message": "Tushare 暂无稳定可替代的港股物业指数，本轮先保留占位。"
        }
      ]
    },
    {
      "board_id": "catering",
      "title": "餐饮",
      "anchor": "catering",
      "description": "餐饮板块先用调味发酵品与食品加工两条申万行业线，观察消费品估值弹性与成交热度。",
      "fundamentals_placeholder": {
        "title": "基本面数据跟踪待补充",
        "description": "后续将在这里补充餐饮需求、渠道动销、成本价格与开店节奏等指标。",
        "planned_metrics": [
          "餐饮社零与客单价",
          "调味品渠道库存与动销",
          "原材料价格与毛利率跟踪",
          "门店扩张与闭店节奏"
        ]
      },
      "industries": [
        {
          "ts_code": "801129.SI",
          "name": "调味发酵品",
          "market": "A股",
          "enabled": true,
          "status": "ready",
          "status_message": "关注调味发酵品板块的 PB 位置、ROE 韧性与成交拥挤度。",
          "latest_trade_date": "2026-10-09",
          "latest_close": 6575.23,
          "latest_pct_change": -0.53,
          "pb": 3.46,
          "amount": 429308.0,
          "float_mv": 12874218.0,
          "member_count": 14,
          "pb_percentiles": {
            "three_year": 13.9,
            "five_year": 8.3
          },
          "crowdedness": {
            "amount_pct": 62.3,
            "turnover_ratio_pct": 62.3,
            "score": 62.3,
            "label": "中性"
          },
          "pb_roe_alignment": {
            "pb_pct_3y": 13.9,
            "pb_pct_5y": 8.3,
            "roe_pct_20q": 52.6,
            "current_roe": 5.85,
            "current_roe_period": "2026-06-30",
            "match_gap": -44.3,
            "status": "cheap_vs_roe",
            "label": "业绩强于估值"
          }
        },
        {
          "ts_code": "801124.SI",
          "name": "食品加工",
          "market": "A股",
          "enabled": true,
          "status": "ready",
          "status_message": "关注食品加工板块的 PB 位置、ROE 韧性与成交拥挤度。",
          "latest_trade_date": "2026-10-09",
          "latest_close": 12295.18,
          "latest_pct_change": 1.18,
          "pb": 2.05,
          "amount": 314920.0,
          "float_mv": 9399117.0,
          "member_count": 25,
          "pb_percentiles": {
            "three_year": 15.0,
            "five_year": 9.0
          },
          "crowdedness": {
            "amount_pct": 43.3,
            "turnover_ratio_pct": 58.3,
            "score": 50.8,
            "label": "中性"
          },
          "pb_roe_alignment": {
            "pb_pct_3y": 15.0,
            "pb_pct_5y": 9.0,
            "roe_pct_20q": 26.3,
            "current_roe": 1.68,
            "current_roe_period": "2026-06-30",
            "match_gap": -17.3,
            "status": "balanced",
            "label": "估值与业绩基本匹配"
          }
        }
      ]
    },
    {
      "board_id": "hotel",
      "title": "酒店",
      "anchor": "hotel",
      "description": "酒店板块同时展示酒店与旅游及景区两条行业线，用于观察社服资产的景气预期与估值位置。",
      "fundamentals_placeholder": {
        "title": "基本面数据跟踪待补充",
        "description": "后续将在这里补充 RevPAR、入住率、出行景气与客流恢复等高频指标。",
        "planned_metrics": [
          "酒店入住率与 RevPAR",
          "航班量、铁路客运量与景区客流",
          "节假日出游强度",
          "门店扩张与加盟结构"
        ]
      },
      "industries": [
        {
          "ts_code": "852121.SI",
          "name": "酒店",
          "market": "A股",
          "enabled": true,
          "status": "ready",
          "status_message": "关注酒店板块的 PB 位置、ROE 修复与交易拥挤度。",
          "latest_trade_date": "2026-10-09",
          "latest_close": 2166.53,
          "latest_pct_change": 2.26,
          "pb": 1.28,
          "amount": 57777.0,
          "float_mv": 1808645.0,
          "member_count": 5,
          "pb_percentiles": {
            "three_year": 5.1,
            "five_year": 3.1
          },
          "crowdedness": {
            "amount_pct": 17.1,
            "turnover_ratio_pct": 35.7,
            "score": 26.4,
            "label": "不拥挤"
          },
          "pb_roe_alignment": {
            "pb_pct_3y": 5.1,
            "pb_pct_5y": 3.1,
            "roe_pct_20q": 63.2,
            "current_roe": 1.44,
            "current_roe_period": "2026-06-30",
            "match_gap": -60.1,
            "status": "cheap_vs_roe",
            "label": "业绩强于估值"
          }
        },
        {
          "ts_code": "801993.SI",
          "name": "旅游及景区",
          "market": "A股",
          "enabled": true,
          "status": "ready",
          "status_message": "关注旅游及景区板块的 PB 位置、ROE 修复与交易拥挤度。",
          "latest_trade_date": "2026-10-09",
          "latest_close": 1855.79,
          "latest_pct_change": 1.23,
          "pb": 2.38,
          "amount": 300538.0,
          "float_mv": 6214883.0,
          "member_count": 25,
          "pb_percentiles": {
            "three_year": 6.3,
            "five_year": 9.5
          },
          "crowdedness": {
            "amount_pct": 33.7,
            "turnover_ratio_pct": 42.1,
            "score": 37.9,
            "label": "不拥挤"
          },
          "pb_roe_alignment": {
            "pb_pct_3y": 6.3,
            "pb_pct_5y": 9.5,
            "roe_pct_20q": 52.6,
            "current_roe": 1.41,
            "current_roe_period": "2026-06-30",
            "match_gap": -43.1,
            "status": "cheap_vs_roe",
            "label": "业绩强于估值"
          }
        }
      ]
    }
  ]
}